{
  "$schema": "https://json-schema.org/draft/2020-12/schema",
  "$id": "https://adarsh.local/build-hifi/strategy.schema.json",
  "title": "Strategy",
  "description": "Produced by the Beat 0.5 strategy agent from BRIEF-BUNDLE.md. Encodes the strategic POV for the entire prototype: cornerstone surface, IA philosophy, motion personality, content voice. Downstream agents (screens, IA, style-baseline, every screen-fill) read this to make consistent choices.",
  "type": "object",
  "additionalProperties": false,
  "required": ["cornerstoneScreen", "iaPhilosophy", "primaryPersona", "motionPersonality", "contentVoice", "densityTarget"],
  "properties": {
    "cornerstoneScreen": {
      "description": "The route path that is the heart of the experience. Other screens funnel toward this. Must match a path in screens.json.",
      "type": "string",
      "pattern": "^/"
    },
    "cornerstoneJustification": {
      "description": "1-3 sentence explanation of WHY this screen is the cornerstone.",
      "type": "string",
      "minLength": 30,
      "maxLength": 600
    },
    "iaPhilosophy": {
      "description": "How the user navigates the app.",
      "type": "string",
      "enum": ["hub_spoke", "linear", "deep_nested", "tabbed"]
    },
    "primaryPersona": {
      "type": "object",
      "additionalProperties": false,
      "required": ["name", "role", "jtbd"],
      "properties": {
        "name": { "type": "string", "minLength": 1, "maxLength": 60 },
        "role": { "type": "string", "minLength": 1, "maxLength": 80 },
        "jtbd": {
          "description": "Job to be done in one sentence.",
          "type": "string",
          "minLength": 15,
          "maxLength": 300
        }
      }
    },
    "motionPersonality": {
      "description": "Style of animation throughout the app.",
      "type": "string",
      "enum": ["calm", "punchy", "quiet", "playful"]
    },
    "contentVoice": {
      "description": "Tone of copy across the app.",
      "type": "string",
      "enum": ["regulatory", "consumer", "analytical", "narrative", "operator"]
    },
    "densityTarget": {
      "description": "Information density of the dashboard / list screens.",
      "type": "string",
      "enum": ["low", "medium", "high"]
    },
    "visualReferences": {
      "description": "External references the user pointed at (image paths or URLs). Treated as visual intent signals only.",
      "type": "array",
      "items": { "type": "string", "minLength": 1 },
      "default": []
    },
    "keyInteractions": {
      "description": "List of cornerstone interaction patterns the prototype must expose. Each is a one-line description.",
      "type": "array",
      "minItems": 1,
      "maxItems": 8,
      "items": { "type": "string", "minLength": 10, "maxLength": 200 }
    },
    "navigationPolicy": {
      "description": "Cornerstone reachability constraint. The cornerstone must be ≤N clicks from the dashboard.",
      "type": "object",
      "additionalProperties": false,
      "properties": {
        "maxClicksToCornerstone": { "type": "integer", "minimum": 1, "maximum": 4, "default": 2 },
        "homeRoute": { "type": "string", "pattern": "^/", "default": "/dashboard" }
      }
    }
  }
}
